{
  "$schema": "http://json-schema.org/draft-07/schema#",
  "title": "MCP Servers Configuration Schema",
  "description": "JSON Schema for MCP (Model Context Protocol) servers configuration file",
  "type": "object",
  "required": ["version", "servers", "global_settings"],
  "properties": {
    "version": {
      "type": "string",
      "pattern": "^\\d+\\.\\d+$",
      "description": "配置文件版本号"
    },
    "description": {
      "type": "string",
      "description": "配置文件描述"
    },
    "servers": {
      "type": "object",
      "description": "MCP服务器配置",
      "patternProperties": {
        "^[a-zA-Z][a-zA-Z0-9_-]*$": {
          "type": "object",
          "oneOf": [
            {
              "description": "命令行启动的MCP服务器",
              "required": ["command", "args", "enabled"],
              "properties": {
                "command": {
                  "type": "string",
                  "description": "启动命令"
                },
                "args": {
                  "type": "array",
                  "items": {"type": "string"},
                  "description": "命令参数"
                },
                "enabled": {
                  "type": "boolean",
                  "description": "是否启用此服务器"
                },
                "description": {
                  "type": "string",
                  "description": "服务器描述"
                },
                "category": {
                  "type": "string",
                  "enum": ["utility", "network", "storage", "development", "system"],
                  "description": "服务器分类"
                },
                "env": {
                  "type": "object",
                  "description": "环境变量"
                },
                "timeout": {
                  "type": "integer",
                  "minimum": 1,
                  "description": "超时时间（秒）"
                }
              },
              "additionalProperties": false
            },
            {
              "description": "SSE协议的MCP服务器",
              "required": ["type", "config", "enabled"],
              "properties": {
                "type": {
                  "type": "string",
                  "const": "sse",
                  "description": "服务器类型：SSE"
                },
                "config": {
                  "type": "object",
                  "required": ["url"],
                  "properties": {
                    "url": {
                      "type": "string",
                      "format": "uri",
                      "description": "SSE服务器URL"
                    }
                  },
                  "additionalProperties": false
                },
                "enabled": {
                  "type": "boolean",
                  "description": "是否启用此服务器"
                },
                "description": {
                  "type": "string",
                  "description": "服务器描述"
                },
                "category": {
                  "type": "string",
                  "enum": ["utility", "network", "storage", "development", "system", "kubernetes"],
                  "description": "服务器分类"
                }
              },
              "additionalProperties": false
            },
            {
              "description": "Streamable HTTP协议的MCP服务器",
              "required": ["type", "config", "enabled"],
              "properties": {
                "type": {
                  "type": "string",
                  "const": "streamable-http",
                  "description": "服务器类型：Streamable HTTP"
                },
                "config": {
                  "type": "object",
                  "required": ["url"],
                  "properties": {
                    "url": {
                      "type": "string",
                      "format": "uri",
                      "description": "Streamable HTTP服务器URL"
                    }
                  },
                  "additionalProperties": false
                },
                "enabled": {
                  "type": "boolean",
                  "description": "是否启用此服务器"
                },
                "description": {
                  "type": "string",
                  "description": "服务器描述"
                },
                "category": {
                  "type": "string",
                  "enum": ["utility", "network", "storage", "development", "system", "kubernetes"],
                  "description": "服务器分类"
                }
              },
              "additionalProperties": false
            }
          ]
        }
      },
      "additionalProperties": false
    },
    "global_settings": {
      "type": "object",
      "required": ["max_concurrent_servers", "log_level"],
      "properties": {
        "max_concurrent_servers": {
          "type": "integer",
          "minimum": 1,
          "maximum": 50,
          "description": "最大并发服务器数量"
        },
        "log_level": {
          "type": "string",
          "enum": ["DEBUG", "INFO", "WARNING", "ERROR"],
          "description": "日志级别"
        },
        "enable_hot_reload": {
          "type": "boolean",
          "description": "是否启用热重载"
        }
      },
      "additionalProperties": false
    },
    "categories": {
      "type": "object",
      "description": "服务器分类定义",
      "patternProperties": {
        "^[a-z][a-z0-9_]*$": {
          "type": "object",
          "required": ["name", "description"],
          "properties": {
            "name": {
              "type": "string",
              "description": "分类显示名称"
            },
            "description": {
              "type": "string",
              "description": "分类描述"
            },
            "color": {
              "type": "string",
              "pattern": "^#[0-9a-fA-F]{6}$",
              "description": "分类颜色（十六进制）"
            }
          },
          "additionalProperties": false
        }
      },
      "additionalProperties": false
    },
    "metadata": {
      "type": "object",
      "description": "元数据信息",
      "properties": {
        "created_at": {
          "type": "string",
          "format": "date-time",
          "description": "创建时间"
        },
        "last_modified": {
          "type": "string", 
          "format": "date-time",
          "description": "最后修改时间"
        },
        "schema_version": {
          "type": "string",
          "description": "Schema版本"
        },
        "author": {
          "type": "string",
          "description": "作者"
        },
        "notes": {
          "type": "array",
          "items": {
            "type": "string"
          },
          "description": "备注信息"
        }
      },
      "additionalProperties": false
    }
  },
  "additionalProperties": false
} 