{
  "version": "1.0",
  "description": "MCP (Model Context Protocol) 服务器配置文件",
  "servers": {
    "time": {
      "command": "uvx",
      "args": ["mcp-server-time", "--local-timezone=Asia/Shanghai"],
      "enabled": true,
      "description": "时间和日期操作服务，支持亚洲/上海时区",
      "category": "utility"
    },
    "fetch": {
      "command": "uvx", 
      "args": ["mcp-server-fetch"],
      "enabled": true,
      "description": "HTTP网页抓取服务，用于获取网页内容和实时信息",
      "category": "network"
    },
    "memory": {
      "command": "npx",
      "args": ["-y", "@modelcontextprotocol/server-memory"],
      "enabled": true,
      "description": "外部内存存储服务，提供持久化数据存储功能",
      "category": "storage"
    }
  },
  "global_settings": {
    "max_concurrent_servers": 10,
    "log_level": "INFO",
    "enable_hot_reload": true
  },
  "categories": {
    "utility": {
      "description": "实用工具类服务",
      "color": "blue"
    },
    "network": {
      "description": "网络访问类服务", 
      "color": "green"
    },
    "storage": {
      "description": "数据存储类服务",
      "color": "yellow"
    }
  },
  "metadata": {
    "created_at": "2025-06-15T15:00:00Z",
    "last_modified": "2025-06-15T15:00:00Z",
    "schema_version": "1.0",
    "author": "Qwen-Agent MVP",
    "notes": [
      "此配置文件定义了所有可用的MCP服务器",
      "可以通过设置enabled字段来启用/禁用特定服务器",
      "支持热重载，修改配置文件后无需重启应用",
      "遵循fail-fast原则：任何连接或配置问题都会立即失败"
    ]
  }
} 